{
  "contract_id": "SF-CON-APPLICATION-CASE-SM",
  "contract_status": "PROPOSED",
  "freeze_status": "NOT_FROZEN",
  "owner_component": "CMP-015",
  "tenant_id": "11111111-1111-4111-8111-111111111111",
  "application_id": "22222222-2222-4222-8222-222222222222",
  "command": "ENTER_SCRUTINY",
  "from_state": "RECEIVED",
  "to_state": "UNDER_SCRUTINY",
  "transition_key": "RECEIVED>UNDER_SCRUTINY",
  "transition_class": "ALWAYS_LEGAL",
  "expected_state": "RECEIVED",
  "aggregate_version": 4,
  "idempotency_key": "submit-scrutiny-0001",
  "authz_decision_id": "99999999-9999-4999-8999-999999999999",
  "correlation_id": "bbbbbbbb-bbbb-4bbb-8bbb-bbbbbbbbbbbb",
  "actor_type": "OFFICER",
  "actor_id": "aaaaaaaa-aaaa-4aaa-8aaa-aaaaaaaaaaaa",
  "reason_code": "ENTER_SCRUTINY",
  "outbox_required": true
}
